{"schema_version": "1.0", "document_id": "mini", "domain": "markdown", "source": {"path": "schema/example/mini.md", "sha256": "56ca6f95ceb762a42856dfe89ca187bea2533ae6d9f7be5cad5734db34013e74", "n_bytes": 92}, "tokenizer": {"model": "Llama-3.2-1B-Instruct-Q4_K_M.gguf", "vocab_size": 128256, "bos": 128000, "eos": 128009, "eot": 128009}, "prompt": {"prefix": {"text": "<|begin_of_text|><|start_header_id|>system<|end_header_id|>\n\nYou are a careful assistant. Answer the question using only the document. Reply with a short, direct answer.<|eot_id|><|start_header_id|>user<|end_header_id|>\n\n<document>\n", "tokens": [128000, 128006, 9125, 128007, 271, 2675, 527, 264, 16994, 18328, 13, 22559, 279, 3488, 1701, 1193, 279, 2246, 13, 18321, 449, 264, 2875, 11, 2167, 4320, 13, 128009, 128006, 882, 128007, 271, 27, 6190, 397], "positions": [0, 1, 2, 3, 4, 5, 6, 7, 8, 9, 10, 11, 12, 13, 14, 15, 16, 17, 18, 19, 20, 21, 22, 23, 24, 25, 26, 27, 28, 29, 30, 31, 32, 33, 34], "seq_ids": [0, 1]}, "question_template": "\n</document>\n\nQuestion: {question}<|eot_id|><|start_header_id|>assistant<|end_header_id|>\n\n"}, "layout": {"n_seq": 2, "merge_rules": {"split_node_types": ["heading"], "min_unit_tokens": 4, "effective_min_unit_tokens": 4, "max_sequences": 32, "small_splittable_siblings": "merged_group if >= 2 consecutive and together >= min_unit_tokens, else absorbed into the parent unit", "non_splittable": "absorbed into the parent unit with the whole subtree"}, "units": [{"id": "u0", "kind": "root", "parent_unit": null, "root_nodes": ["n0"], "nodes": ["n0"], "seq_ids": [0, 1], "pos_start": 35, "pos_end": 35, "n_tokens": 0, "reordered": false}, {"id": "u1", "kind": "subtree", "parent_unit": "u0", "root_nodes": ["n1"], "nodes": ["n1"], "seq_ids": [0, 1], "pos_start": 35, "pos_end": 38, "n_tokens": 3, "reordered": false}, {"id": "u2", "kind": "subtree", "parent_unit": "u1", "root_nodes": ["n2"], "nodes": ["n2", "n3"], "seq_ids": [0], "pos_start": 38, "pos_end": 47, "n_tokens": 9, "reordered": false}, {"id": "u3", "kind": "subtree", "parent_unit": "u1", "root_nodes": ["n4"], "nodes": ["n4", "n5"], "seq_ids": [1], "pos_start": 38, "pos_end": 47, "n_tokens": 9, "reordered": false}]}, "nodes": [{"id": "n0", "node_type": "document", "parent": null, "children": ["n1"], "depth": 0, "title": "", "path": "", "attrs": {}, "unit": "u0", "text": "", "tokens": [], "positions": [], "seq_ids": [], "token_class": ""}, {"id": "n1", "node_type": "heading", "parent": "n0", "children": ["n2", "n4"], "depth": 1, "title": "Report", "path": "Report", "attrs": {"level": 1}, "unit": "u1", "text": "# Report\n\n", "tokens": [2, 8423, 271], "positions": [35, 36, 37], "seq_ids": [0, 1], "token_class": "MCW"}, {"id": "n2", "node_type": "heading", "parent": "n1", "children": ["n3"], "depth": 2, "title": "Intro", "path": "Report > Intro", "attrs": {"level": 2}, "unit": "u2", "text": "## Intro\n\n", "tokens": [567, 53086, 271], "positions": [38, 39, 40], "seq_ids": [0], "token_class": "MCW"}, {"id": "n3", "node_type": "paragraph", "parent": "n2", "children": [], "depth": 3, "title": "", "path": "Report > Intro", "attrs": {}, "unit": "u2", "text": "This paper studies efficient attention.\n\n", "tokens": [2028, 5684, 7978, 11297, 6666, 382], "positions": [41, 42, 43, 44, 45, 46], "seq_ids": [0], "token_class": "CCCCCC"}, {"id": "n4", "node_type": "heading", "parent": "n1", "children": ["n5"], "depth": 2, "title": "Methods", "path": "Report > Methods", "attrs": {"level": 2}, "unit": "u3", "text": "## Methods\n\n", "tokens": [567, 19331, 271], "positions": [38, 39, 40], "seq_ids": [1], "token_class": "MCW"}, {"id": "n5", "node_type": "paragraph", "parent": "n4", "children": [], "depth": 3, "title": "", "path": "Report > Methods", "attrs": {}, "unit": "u3", "text": "We use 12 samples.\n", "tokens": [1687, 1005, 220, 717, 10688, 627], "positions": [41, 42, 43, 44, 45, 46], "seq_ids": [1], "token_class": "CCWCCC"}], "stats": {"n_nodes": 6, "node_type_counts": {"document": 1, "heading": 3, "paragraph": 2}, "tree_depth": 3, "n_doc_tokens": 21, "n_prefix_tokens": 35, "markup_tokens": 3, "whitespace_tokens": 4, "content_tokens": 14, "markup_share": 0.14285714285714285, "whitespace_share": 0.19047619047619047, "markup_or_whitespace_share": 0.3333333333333333, "n_units": 4, "n_seq": 2, "n_merged_groups": 0, "n_small_subtrees_merged": 0, "section_subtree_tokens": {"n": 3, "min": 9, "median": 9, "mean": 13.0, "max": 21}, "unit_tokens": {"n": 4, "min": 0, "median": 6.0, "mean": 5.2, "max": 9}, "leaf_unit_tokens": {"n": 2, "min": 9, "median": 9.0, "mean": 9.0, "max": 9}, "visible_tokens_per_seq": {"n": 2, "min": 47, "median": 47.0, "mean": 47.0, "max": 47}, "visible_fraction_mean": 0.8392857142857143, "flat_prompt_tokens": 56}}
